{
  "input_authority": {
    "mode": "draft_submission",
    "artifact_sha256": "sha256:8888888888888888888888888888888888888888888888888888888888888888",
    "authority_record_sha256": "sha256:dd030b7b73d54cc303f70e1c81a2d0b73d3cd7ad8b11c6c9c7db38293e3ad996",
    "human_approval_decision_id": null,
    "selection_rationale": "Candidate 2 preserves four independently placeable transition, base, and head components at game scale.",
    "maximum_driver_action": "request_admin_review"
  },
  "path": "hybrid",
  "rationale": "Four conceptual components remain separable while the base transition uses retained video-derived frames.",
  "design_guidelines": {
    "artistic_direction": "One crisp mechanical-light language shared by four separable components.",
    "concept_twist": "A familiar illuminated machine assembly becomes a continuously growing role-readable snake.",
    "structure": "sprite",
    "body_strategy": "B1 remains readable at 4 cells, T1/T2 occupy only the tail half, H ends by cell 6, and all components keep independent fallbacks on long turns.",
    "head_zone": "light_field_dark_core",
    "asset_strategy": "Extract T1, T2, and H as verified RGBA objects; derive B1 from one journaled 20 fps cycle; never pack components into columns."
  },
  "common_period_ms": 2400,
  "fidelity_features": ["T1 tail transition", "T2 tail detail", "B1 animated base", "H head detail"],
  "layer_plan": [
    "T1 Fallback precedes T1 Image on the final half of the snake",
    "T2 Fallback precedes T2 Image on the final half of the snake",
    "B1 Fallback precedes B1 Image across the whole snake",
    "H Fallback precedes H Image from the head through cell 6"
  ],
  "asset_plan": [
    {
      "kind": "overlay", "natural_length_cells": 8, "frames": 1,
      "desired_fps": null, "texels_per_cell": 64, "raster_overhang_px": 4,
      "anchor": "tail", "fit": "clip", "tile_phase_origin": null,
      "fade": "leading", "transverse_edge_policy": "fail_closed_transparent_effect",
      "prompt": "Use the exact retained transparent T1 object; preserve the bounded overhang and do not add a background."
    },
    {
      "kind": "overlay", "natural_length_cells": 6, "frames": 1,
      "desired_fps": null, "texels_per_cell": 64, "raster_overhang_px": 4,
      "anchor": "tail", "fit": "clip", "tile_phase_origin": null,
      "fade": "leading", "transverse_edge_policy": "fail_closed_transparent_effect",
      "prompt": "Reuse the exact authorized transparent T2 object without packing or repainting it."
    },
    {
      "kind": "sheet", "natural_length_cells": 40, "frames": 48,
      "desired_fps": 20, "texels_per_cell": 16, "raster_overhang_px": 4,
      "anchor": "whole", "fit": "tile", "tile_phase_origin": "tail",
      "fade": "none", "transverse_edge_policy": "fail_closed_transparent_effect",
      "prompt": "Use the exact retained B1 sheet: 40 columns, 48 rows, 24 transverse texels per row, true final-to-zero loop, no gutters."
    },
    {
      "kind": "overlay", "natural_length_cells": 6, "frames": 1,
      "desired_fps": null, "texels_per_cell": 64, "raster_overhang_px": 4,
      "anchor": "head", "fit": "clip", "tile_phase_origin": null,
      "fade": "trailing", "transverse_edge_policy": "fail_closed_transparent_effect",
      "prompt": "Use the exact retained transparent H object from the head through cell 6."
    }
  ],
  "modifier_plan": [
    {
      "asset_index": 0, "logical_key": "tail_transition", "component_key": "T1",
      "texture_name": "modifier_t1", "image_layer_name": "T1 Image", "fallback_layer_name": "T1 Fallback",
      "span_limit_mode": "tail_fraction", "span_limit_value": 0.5,
      "source_mode": "extracted_rgba",
      "source_object_sha256": "sha256:1010101010101010101010101010101010101010101010101010101010101010",
      "modifier_manifest_sha256": "sha256:157743c03452cbc974a74156ace1198a82de7ce049c136182c5457d9ea79840b",
      "provenance_sha256": "sha256:1212121212121212121212121212121212121212121212121212121212121212",
      "license_id": "owned-original", "authorized_lineage_ids": ["concept-modifier-workflow"],
      "required_capabilities": ["fixture.extract_rgba_v1"],
      "extraction": {"source_arena": "reserved_empty", "alpha_contract": "transparent_rgba", "background_removal": "required", "matte_policy": "fail_closed", "cropped_object_retained": true},
      "video": null
    },
    {
      "asset_index": 1, "logical_key": "tail_detail", "component_key": "T2",
      "texture_name": "modifier_t2", "image_layer_name": "T2 Image", "fallback_layer_name": "T2 Fallback",
      "span_limit_mode": "tail_fraction", "span_limit_value": 0.5,
      "source_mode": "reused_object",
      "source_object_sha256": "sha256:2020202020202020202020202020202020202020202020202020202020202020",
      "modifier_manifest_sha256": "sha256:3cd92f814c2b560f62cbe65677e5165b7112d59edbc375e0069022a58b016526",
      "provenance_sha256": "sha256:2222222222222222222222222222222222222222222222222222222222222222",
      "license_id": "owned-original", "authorized_lineage_ids": ["concept-modifier-workflow"],
      "required_capabilities": ["fixture.reuse_modifier_v1"], "extraction": null, "video": null
    },
    {
      "asset_index": 2, "logical_key": "body_transition", "component_key": "B1",
      "texture_name": "modifier_b1", "image_layer_name": "B1 Image", "fallback_layer_name": "B1 Fallback",
      "span_limit_mode": "whole", "span_limit_value": null,
      "source_mode": "video_frames",
      "source_object_sha256": "sha256:3030303030303030303030303030303030303030303030303030303030303030",
      "modifier_manifest_sha256": "sha256:b570901d2e5e0ca23026a3b272a008b6618475daddc1eca25a14270d7c419c64",
      "provenance_sha256": "sha256:3232323232323232323232323232323232323232323232323232323232323232",
      "license_id": "owned-original", "authorized_lineage_ids": ["concept-modifier-workflow"],
    "required_capabilities": ["fal-ai/pixverse/v6/transition", "fixture.frame_extraction_v1"],
      "extraction": {"source_arena": "reserved_empty", "alpha_contract": "exact_mask_matte", "background_removal": "required", "matte_policy": "fail_closed", "cropped_object_retained": true},
      "video": {
        "start_frame_sha256": "sha256:3333333333333333333333333333333333333333333333333333333333333333",
        "end_frame_sha256": "sha256:3434343434343434343434343434343434343434343434343434343434343434",
        "source_video_sha256": "sha256:3535353535353535353535353535353535353535353535353535353535353535",
        "extracted_sheet_sha256": "sha256:3030303030303030303030303030303030303030303030303030303030303030",
        "common_period_ms": 2400, "desired_fps": 20, "derived_frame_rows": 48,
        "effective_frame_row_cap": 85,
        "frame_extraction": "deterministic_uniform_full_period",
        "alpha_matte_verification": "fail_closed", "loop_closure": "true_final_to_zero",
        "retained_inputs_and_output": true
      }
    },
    {
      "asset_index": 3, "logical_key": "head_detail", "component_key": "H",
      "texture_name": "modifier_h", "image_layer_name": "H Image", "fallback_layer_name": "H Fallback",
      "span_limit_mode": "head_cells", "span_limit_value": 6,
      "source_mode": "extracted_rgba",
      "source_object_sha256": "sha256:4040404040404040404040404040404040404040404040404040404040404040",
      "modifier_manifest_sha256": "sha256:445e3df5646ccd01ea1daf20a59af14196b4461b8bd359412252c19b8dd481b1",
      "provenance_sha256": "sha256:4242424242424242424242424242424242424242424242424242424242424242",
      "license_id": "owned-original", "authorized_lineage_ids": ["concept-modifier-workflow"],
      "required_capabilities": ["fixture.extract_rgba_v1"],
      "extraction": {"source_arena": "reserved_empty", "alpha_contract": "transparent_rgba", "background_removal": "required", "matte_policy": "fail_closed", "cropped_object_retained": true},
      "video": null
    }
  ],
  "animation_plan": ["B1 uses all 48 deterministic rows over the common 2400ms period and verifies the true final-to-zero transition"],
  "required_wrap_axes": ["x", "y"],
  "risks": ["The interactive host may not advertise extraction, reuse, or video; return platform_gap before side effects"]
}
